{"$id":"urn:otqa:v1:problem","$schema":"https://json-schema.org/draft/2020-12/schema","additionalProperties":false,"properties":{"alternative_ids":{"items":{"pattern":"^[A-Za-z0-9][A-Za-z0-9._-]{0,127}$","type":"string"},"minItems":1,"type":"array","uniqueItems":true},"alternatives":{"items":{"items":{"maximum":1,"minimum":0,"type":"number"},"minItems":1,"type":"array"},"minItems":1,"type":"array"},"objective_ids":{"items":{"pattern":"^[A-Za-z0-9][A-Za-z0-9._-]{0,127}$","type":"string"},"minItems":1,"type":"array","uniqueItems":true},"problem_id":{"pattern":"^[A-Za-z0-9][A-Za-z0-9._-]{0,127}$","type":"string"},"schema_version":{"const":1}},"required":["schema_version","problem_id","alternative_ids","objective_ids","alternatives"],"type":"object"}
