{"alternative_ids":["a0","a1","a2","a3","a4"],"alternatives":[[0.9955033531412338,0.7691119302806703,0.030858761587652217,0.20060543428738797,0.11192355736078541,0.27772031423803945,0.11877167616087736],[0.9990130327270137,0.9072668976776536,0.05853438946820089,0.8620366866308707,0.9607762347646955,0.08219232299071288,0.8277578874345741],[0.4071542260132648,0.24052466435779507,0.297206408655455,0.5024349036391653,0.15711788774302726,0.8311732979211653,0.5146559137169764],[0.9877548544607312,0.30379240428061693,0.6304996979205209,0.7696270911730749,0.8285169823789921,0.5916167636428763,0.3417606060655094],[0.2582083944474697,0.7913108197988517,0.43176178365864704,0.08155227257459308,0.014820502513785971,0.09778408497590252,0.5545773825903192]],"objective_ids":["g0","g1","g2","g3","g4","g5","g6"],"problem_id":"d7-m5-c000021","schema_version":1}
